{
  "schema_version": "1.0.0",
  "curriculum_id": "ai-engineer-english-interview",
  "title": "AI 엔지니어 영어 면접 말하기",
  "locale": "ko-KR",
  "numbering": { "phase_base": 1 },
  "prerequisite_shorthand": "none",
  "prerequisite_ordering": { "mode": "id_numeric_tuple" },
  "phases": [
    {
      "id": "1",
      "title": "말하기 기본기",
      "order": 1,
      "exit_capability": "다섯 박자(H-P-D-H-R) 구조로 임의의 프로젝트를 영어로 설명하고, 네 박자 구조로 자기소개를 길이별로 말할 수 있습니다.",
      "sections": [
        {
          "id": "1.1",
          "phase_id": "1",
          "title": "프레임워크와 표현",
          "order": 1,
          "topics": [
            {
              "id": "1.1.1",
              "section_id": "1.1",
              "title": "영어로 프로젝트를 말하는 법 (5-Beat 프레임워크)",
              "order": 1,
              "learning_objectives": [
                "다섯 박자(Headline, Problem, Decision, Hard Part, Result) 구조로 임의의 프로젝트를 30초·90초·심화 세 버전으로 영어로 말할 수 있다."
              ],
              "learning_content": ["5-Beat 구조", "H-P-D-H-R", "버전 사다리", "즉석 사고법", "만능 표현", "전달과 발음"],
              "lab": null,
              "prerequisites": []
            },
            {
              "id": "1.1.2",
              "section_id": "1.1",
              "title": "만능 표현과 숫자·발음 드릴",
              "order": 2,
              "learning_objectives": [
                "여덟 개 프로젝트의 한 줄 요약과 핵심 숫자를 영어로 또박또박 말할 수 있다."
              ],
              "learning_content": ["한 줄 요약", "숫자 드릴", "전환 표현", "비교·결정 표현", "압박 상황 표현"],
              "lab": null,
              "prerequisites": ["1.1.1"]
            }
          ]
        },
        {
          "id": "1.2",
          "phase_id": "1",
          "title": "자기소개",
          "order": 2,
          "topics": [
            {
              "id": "1.2.1",
              "section_id": "1.2",
              "title": "자기소개 (Tell me about yourself)",
              "order": 1,
              "learning_objectives": [
                "Present-Thread-Proof-Fit 네 박자 구조로 90초 자기소개를 막힘없이 말하고, 차별점 한 줄을 제시할 수 있다."
              ],
              "learning_content": ["Present-Thread-Proof-Fit", "차별점 한 줄", "커리어 흐름", "꼬리질문 대비"],
              "lab": null,
              "prerequisites": ["1.1.1"]
            }
          ]
        }
      ]
    },
    {
      "id": "2",
      "title": "프로젝트 정답지",
      "order": 2,
      "exit_capability": "여덟 개 프로젝트 각각을 버전별로 설명하고, 예상 꼬리질문에 사실에 근거해 답할 수 있습니다.",
      "sections": [
        {
          "id": "2.1",
          "phase_id": "2",
          "title": "플랜티넷 프로젝트",
          "order": 1,
          "topics": [
            {
              "id": "2.1.1",
              "section_id": "2.1",
              "title": "ReAct + Reflexion 자기개선 에이전트",
              "order": 1,
              "learning_objectives": [
                "실패에서 학습하는 Reflexion 구조와 동일 작업 재시도 약 55퍼센트 감소를 영어로 설명할 수 있다."
              ],
              "learning_content": ["ReAct", "Reflexion", "LessonsStore", "Evaluator 2단계", "LLMOps 관측 5종", "17개 도구"],
              "lab": null,
              "prerequisites": ["1.1.1"]
            },
            {
              "id": "2.1.2",
              "section_id": "2.1",
              "title": "URL 스미싱 탐지 시스템",
              "order": 2,
              "learning_objectives": [
                "외부 API를 자체 모델로 대체한 결정과 실환경 F1 28.79에서 96.10퍼센트 향상을 분포 구분과 함께 설명할 수 있다."
              ],
              "learning_content": ["URLBert 파인튜닝", "HTML 17 피처", "단축 URL", "시계열 모니터링", "F1"],
              "lab": null,
              "prerequisites": ["1.1.1"]
            },
            {
              "id": "2.1.3",
              "section_id": "2.1",
              "title": "Milvus Agentic RAG 시스템",
              "order": 3,
              "learning_objectives": [
                "하이브리드 검색과 안전 계층으로 Top-5 Recall 약 35퍼센트 향상을 설명할 수 있다."
              ],
              "learning_content": ["하이브리드 검색", "BGE-M3", "BM25", "Reranker", "LlamaGuard", "전처리 노이즈 제거"],
              "lab": null,
              "prerequisites": ["1.1.1"]
            },
            {
              "id": "2.1.4",
              "section_id": "2.1",
              "title": "vLLM 자체 서빙 API",
              "order": 4,
              "learning_objectives": [
                "in-process 서빙 선택 근거와 외부 API 비용 100퍼센트 제거·응답 약 65퍼센트 단축을 설명할 수 있다."
              ],
              "learning_content": ["in-process vLLM", "연속 배칭", "v0/v1 마이그레이션", "요약 길이 수렴 92퍼센트"],
              "lab": null,
              "prerequisites": ["1.1.1"]
            },
            {
              "id": "2.1.5",
              "section_id": "2.1",
              "title": "LLM 평가 파이프라인",
              "order": 5,
              "learning_objectives": [
                "60만 건 무인 평가와 다섯 기준을 단일 호출로 묶어 LLM 추론을 약 1/5로 줄인 설계를 설명할 수 있다."
              ],
              "learning_content": ["LLM-as-judge", "GEval", "단일 호출 5기준", "incremental", "cron+flock", "품질 회귀 감지"],
              "lab": null,
              "prerequisites": ["1.1.1"]
            }
          ]
        },
        {
          "id": "2.2",
          "phase_id": "2",
          "title": "AIO2O & 사이드 프로젝트",
          "order": 2,
          "topics": [
            {
              "id": "2.2.1",
              "section_id": "2.2",
              "title": "Visit Busan 여행 챗봇",
              "order": 1,
              "learning_objectives": [
                "상용 운영 중인 서비스의 2단계 추천과 비기술 이해관계자 협업·오너십을 숫자 없이 가치로 설명할 수 있다."
              ],
              "learning_content": ["2단계 추천", "리뷰 키워드 임베딩", "의미 기반 검색", "상용 운영", "MVP 협의"],
              "lab": null,
              "prerequisites": ["1.1.1"]
            },
            {
              "id": "2.2.2",
              "section_id": "2.2",
              "title": "Skylife 영화 추천 시스템",
              "order": 2,
              "learning_objectives": [
                "rule-based의 한계를 벡터 유사도로 푼 출발점 서사와 추천 다양성 개선을 설명할 수 있다."
              ],
              "learning_content": ["pgvector", "2단계 추천", "추천 다양성", "석사 연구 연결"],
              "lab": null,
              "prerequisites": ["1.1.1"]
            },
            {
              "id": "2.2.3",
              "section_id": "2.2",
              "title": "MarketScope AI 상권분석 SaaS",
              "order": 3,
              "learning_objectives": [
                "기획부터 인프라까지 1인 풀스택으로 배포까지 끌고 간 end-to-end 실행력을 설명할 수 있다."
              ],
              "learning_content": ["LangGraph ReAct 7 tools", "지도-챗봇 동기화", "Entity Linking", "Abstention", "E2E 66/66", "Freemium"],
              "lab": null,
              "prerequisites": ["1.1.1"]
            }
          ]
        }
      ]
    },
    {
      "id": "3",
      "title": "공통 질문 대비",
      "order": 3,
      "exit_capability": "강점·약점·실패·갈등·지원 동기 같은 공통 질문에 STAR 구조로 자기 경험에 근거해 답할 수 있습니다.",
      "sections": [
        {
          "id": "3.1",
          "phase_id": "3",
          "title": "행동·공통 질문",
          "order": 1,
          "topics": [
            {
              "id": "3.1.1",
              "section_id": "3.1",
              "title": "강점·약점·실패·갈등·지원동기 (STAR)",
              "order": 1,
              "learning_objectives": [
                "STAR(Situation-Task-Action-Result) 구조로 강점·약점·실패·갈등·지원 동기 질문에 자기 경험으로 답할 수 있다."
              ],
              "learning_content": ["STAR", "강점", "약점", "실패", "갈등", "지원 동기", "역질문"],
              "lab": null,
              "prerequisites": ["1.1.1", "1.2.1"]
            }
          ]
        }
      ]
    }
  ]
}
